<?xml version="1.0" encoding="UTF-8"?>
<!-- edited with XMLSPY v2004 rel. 4 U (http://www.xmlspy.com) by Deepak Alur (none) -->
<xs:schema targetNamespace="http://java.sun.com/xml/ns/acre/" elementFormDefault="qualified" attributeFormDefault="unqualified" xmlns:xs="http://www.w3.org/2001/XMLSchema" xmlns:pdmquery="http://java.sun.com/xml/ns/acre/">
	<xs:element name="PDMQueryList">
		<xs:annotation>
			<xs:documentation>List of all Queries used in the  PDM definitions</xs:documentation>
		</xs:annotation>
		<xs:complexType>
			<xs:sequence>
				<xs:element ref="pdmquery:Query" minOccurs="0" maxOccurs="unbounded"/>
			</xs:sequence>
			<xs:attribute name="description" type="xs:string" use="optional"/>
		</xs:complexType>
	</xs:element>
	<xs:element name="Query">
		<xs:annotation>
			<xs:documentation>Query definition</xs:documentation>
		</xs:annotation>
		<xs:complexType>
			<xs:sequence>
				<xs:element ref="pdmquery:Argument" minOccurs="0" maxOccurs="unbounded"/>
				<xs:element ref="pdmquery:ReturnVariable" minOccurs="0" maxOccurs="unbounded"/>
			</xs:sequence>
			<xs:attribute name="name" type="xs:string" use="required"/>
			<xs:attribute name="type" type="xs:string" use="required"/>
			<xs:attribute name="relativeFilePath" type="xs:string" use="required"/>
			<xs:attribute name="language" type="xs:string" use="required"/>
			<xs:attribute name="description" type="xs:string" use="required"/>
		</xs:complexType>
	</xs:element>
	<xs:element name="Argument">
		<xs:complexType>
			<xs:attribute name="sequence" type="xs:integer" use="required"/>
			<xs:attribute name="name" type="xs:string" use="required"/>
			<xs:attribute name="type" type="xs:string" use="required"/>
			<xs:attribute name="description" type="xs:string" use="required"/>
			<xs:attribute name="relatedQueryName" type="xs:string" use="optional"/>
			<xs:attribute name="value" type="xs:string" use="optional"/>
		</xs:complexType>
	</xs:element>
	<xs:element name="ReturnVariable">
		<xs:complexType>
			<xs:attribute name="name" type="xs:string" use="required"/>
			<xs:attribute name="type" type="xs:string" use="required"/>
			<xs:attribute name="description" type="xs:string" use="required"/>
		</xs:complexType>
	</xs:element>
</xs:schema>
